,,,,,,
,,,,,,
,,,,,,
,,,,,,
지역,도시명,음식종류,대표메뉴,식당상호,포털 검색명,추천사유
강원도,강릉,매운탕,망치 매운탕,시골식당,강릉 시골식당,강원도도 동해안에서만 나는 망치어종으로 만든 매운탕이며 시원한맛과 밑반찬인 오징어 젓갈이 일품인집이며 현지인들이 추천하는 맛집입니다.
강원도,강릉,멍게비빔밥/물회,멍게비빔밥,제주 해인물회,강릉제주해인물회,해녀출신 사장님이 직접 멍게를 숙성하여 전복과 어울어진 비빔밥과 물회가 유명한 맛집입니다.
강원도,강릉,분식,분식,여고시절 카레 떡볶이,여고시절 카레 떡볶이,학창시절의 추억을 떠오르게 하는 분식집(가격이 많이 오름)
강원도,강릉,분식,분식,옛빙그레,옛빙그레,쫄사리와 김밥이 맛있는집
강원도,강릉,양식,모짜렐라 치즈버거,폴앤메리,강릉 폴앤멜리,강릉가면 무조건 가서 먹는 수제버거집입니다.
강원도,강릉,중식,짬뽕,이만구교동짬뽕,이만구교동짬뽕,교동 짬봉의 원조 집(지금 교동 짬뽕으로 알려진 집은 다른 사장이 인수 한집)
강원도,강릉,"칼국수,만두",장칼국수,현대장칼국수,강릉현대장칼국수,"가격도 저렴하고 맛보장! 백종원3대천왕,생방송투데이 맛집방송"
강원도,강릉,커피,커피,테라로사,테라로사 커피공장,핸드 드립으로 유명한 카페
강원도,강릉,한식,백반,9남매집,9남매집,어머니가 해주시는 집밥을 먹을 수 있는집
강원도,강릉,한식,꼬막무침,강릉전집,강릉전집,엄지네 포장마차의 꼬막 무침 버금가는 꼬막 무침의 숨겨진 맛집
강원도,강릉,한식,조개구이,달선이네 조개마당,달선이네 조개 마당,강릉에서 유일하게 조개 구이를 먹을 수 있는집
강원도,강릉,한식,소고기멸치국수/회비빔국수,오월에초당,오월에초당,멸치육수로낸 국수가 일품이며 가오리회무침이 들어간 비빔국수를 드실수있는 곳입니다.
강원도,강릉,한식,물회,장안횟집,장안횟집,물회와 미역국이 절묘한 만남이 있는집
강원도,강릉,한식,칼국수,청송 칼국수,청송 칼국수,진정한 강릉의 장 칼국수를 맛 볼수 있는집
강원도,강릉,한식,우럭미역국,태광식당,옛 태광 식당,"해장으로 탁월한 우럭 미역국, 밑반찬도 맛남"
강원도,강릉,한식,두부,토담순두부,토담순두부,두부 전골/백반이 유명한집
강원도,강릉,한식,모듬회,해마루,해마루,회로 승부 보는 맛집/스끼다시도 엄청남(강릉에서 뜨는 맛집)
강원도,강릉,횟집,회,건도리 횟집,강릉건도리 횟집,경포바다를 보며 이자까야식 및회를 맛볼수있는 횟집이며 사이드메뉴 및 회를 깔끔하게 드실수 있는 곳
강원도,고성군,한식,막국수/편육,동루골 막국수,동루골 막국수,"시원한 막국수, 담백한 편육, 정부회장님 방문할 정도"
강원도,고성군,한식,물회,부부물회,부부물회,"자연산 회, 항구 근처로 이전 하였으며 교회옆에 있는 곳이 진짜 맛집임"
강원도,동해,삼겹살,대패 삼겹살,장군 시오야기,동해 장군 시오야끼,대패 삼겹살과 파저리의 절묘한 만남
강원도,동해,일식,소바,소복소복,소복소복,새우 튀김 소바가 유명한집
강원도,동해,중식,짬뽕,덕취원,덕취원,동해 북평시장과 함께한 80년 전통의 중화 요리 전문점
강원도,동해,한식,칼국수,대우칼국수,동해 대우 칼국수,소문난 동해 장 칼국수 맛집
강원도,동해,한식,물회/모듬회,동북횟집,동북횟집,당일 잡은 생선으로 만 요리 / 동해 시민도 믿고 먹는 집
강원도,동해,한식,막국수,동원막국수,동해 동원막국수,막국수와 수육이 일품
강원도,동해,한식,물회,부흥회집,부흥횟집,물회가 맛있고 바로 앞에 동해 바다가 있음
강원도,동해,한식,모듬회,선창 횟집,선창횟집,모든 회가 자연산/예약만 하면 식사를 하면서 바다를 볼 수 있음(어달항 앞)
강원도,동해,한식,오리주물럭,소나무식당,소나무식당,오리 주물럭이 환상적이고 집에서 먹는 집밥 맛임
강원도,동해,한식,청국장,유정청국장,동해 유정청국장,"15가지 이상의 밑반찬, 맛깔스러운 청국장이 일품"
강원도,동해,한식,자연산 해산물,주유소,이주민 상가 주유소,"그날 그날 잡은 해산물로 요리, 매일 메뉴가 조금씩 다름"
강원도,동해,한식,설렁탕,한우 설렁탕,한우 설렁탕,든든한 보양식과 같이 설렁탕/9시에서4시까지 영업함
강원도,동해,한식,해천탕,홍대포,홍대포,"문어와 닭, 해물이 푸짐하게 들어간 해천탕이 있는집,(TV 많이 나옴)"
강원도,속초,한식,모듬생선찜,이모네 생선찜,속초 이모네 생선찜,각종 생선찜을 먹을 수 있으며 맛도 양도 푸짐하게 즐길수 있음
강원도,속초,한식,산채비빔밥,점봉산 산채,점봉산 산채,점봉산에서 자생하는 약초로 만들어 신선함
강원도,양양군,한식,섭국,오산횟집,오산횟집,"자연산 섭, 해장에 탁월"
강원도,원주,한식,알탕,까치둥지,까치둥지 알탕,알과 내장이 푸짐하여 술안주 해장에 정말 좋음
강원도,원주,한식,콩국수,봉창이칼국수,봉창이샤브샤브,여름별미로 직접 콩을갈아 걸죽하고 고소한 맛이 일품
강원도,원주,한식,말이고기,산정집,원주 산정집,박순례 손 말이고기 본점이고 유명맛집이라 예약은 필수입니다.
강원도,원주,한식,순두부,수가성,수가성순두부,얼큰해서 해장에 일품
강원도,원주,한식,추어탕,원주복추어탕,원주복추어탕,50년 전통의 추어탕집이며 전국적으로 매우 유명하고 맛도 일품인 맛집임
강원도,원주,한식,낙지,착한낙지,착한낙지,낙지 볶음이 밥도둑
강원도,춘천,닭갈비,막국수,샘밭 닭갈비 막국수,춘천 샘밭 닭갈비 막국수,전통막국수를 맛볼수 있는곳 
강원도,춘천,닭갈비,숯불닭불고기,원조숯불닭불고기,춘천 원조 숯불닭불고기,숯불로 먹는 닭불고기의 끝판왕
강원도,춘천,닭갈비,닭갈비,통나무집 닭갈비,춘천통나무집 닭갈비,오랜 전통으로 맛집으로 유명
강원도,춘천,베이커리,버터크림빵,대원당,춘천 대원당,버터크림빵이 인기있는 50년 전통 춘천 지역명물 베이커리
강원도,춘천,중화요리,짬뽕,몽짬뽕,춘천몽짬뽕,국물맛이 끝내주는 짬뽕의 맛
강원도,춘천,커피,아메리카노,어스17,춘천 earth 17,배경 및 야경이 멋짐
강원도,춘천,한식,닭 불고기,원조 숯불 닭불고기집,원조 숯불 닭불고기집,"춘천 닭갈비로 유명하나 또 다른 닭고기 요리를 맛 볼수 있음, 매콤한 닭불고기 양념을 숯불에 구어 먹으며 닭갈비와는 또다른 맛을 볼수 있음"
강원도,태백,중식,짬뽕,태성각,태백 태성각,해장에 최고
강원도,태백,한식,막국수/수육,강산막국수,강산막국수,막국수와 수육은 물론이고 녹두 부침이 정말 맛남
강원도,태백,한식,생선찜,고갈두,초막 고갈두,"고등어, 갈치, 두부 조림을 한번에 맛 볼수 있는집"
강원도,태백,한식,곱창,미친곱창,미친곱창,곱창 먹고 난뒤의 볶음밥은 최고
강원도,태백,한식,한우,배달실비,,
강원도,태백,한식,소고기,으뜸한우,으뜸한우,태백 지역만의 특유의 소고기로 반찬도 깔끔하고 맛있어서 현지인들이 자주 찾는 맛집 입니다.
강원도,태백,한식,물닭갈비,태백닭갈비,태백닭갈비,태백 지역만의 특유의 물닭갈비로 가격이 저렴하여 현지인들이 자주 찾는 맛집 입니다.
강원도,평창,한식,옹심이칼국수,이촌쉼터,이촌쉼터,가격이 너무너무 아름다운 가격이며 양과 맛은 1.5배입니다.
경기도,가평군,백숙/장어/송어회/매운탕,매운탕/장어/백숙,강마루,삼회리 강마루,음식도 정갈하고 모든음식이 맛있다는 점 !! 신랑이 백숙을 먹고 신세계를 맛보았습니다. 장어는 간장소스 소금으로 다른집과 다른 고급스러움과 청평호 바라보며 먹는 식사란 말할것도 없이 GOOD 입니다 ^^
경기도,고양시,분식,즉석떡볶이,오락즉석떡볶이,라페스타 떡볶이,국물떡볶이 맛집 직접 만들어 먹는 신선한 재료의 맛집
경기도,고양시,양식,파스타,더 비스트로 조선,더 비스트로 조선,한식과 양식의 퓨젼요리로 분위기 있는 곳에서 식사하고 싶을때 좋음.
경기도,고양시,양식,쌀국수,소이연남,소이연남,스타필드 고양 맛집
경기도,고양시,양식,햄버거,쉐이크쉑,쉐이크쉑,스타필드 고양맛집 맛있는버거
경기도,고양시,일식,참치회,마구로야,마구로야,가격대비 평이 좋음
경기도,고양시,일식,초밥,만원의행복초밥,만원의행복초밥,덕이동 숨은 초밥 맛집으로 가성비가 좋음
경기도,고양시,일식,참치회,설참치 백석직영점,일산 설참치,"기본이상의 맛과 친철함, 2인~6인까지 다양한 룸이 있음."
경기도,고양시,일식,초밥,스시윤,스시윤,일반 스시집에 비해 선도도 좋고 맛있음.
경기도,고양시,일식,소바,청사초롱1970,청사초롱1970,"100% 메밀로 만든 소바, 메밀의 고소한 맛을 느낄수 있음."
경기도,고양시,일식,"돈가스, 소바",호천당,일산 호천당,"저렴한 세트메뉴와 두툼한 돈가스, 맛있는 소바"
경기도,고양시,중식,짬뽕,바른짬뽕,바른짬뽕,"무거운 육수의 깊은 맛, 짬뽕에 계란 후라이가 올라가는 특이한 짬뽕"
경기도,고양시,중식,짬뽕,뿅에전설,뿅에전설,"100% 수제면으로 짜장,짬뽕,탕수육이 대표메뉴임"
경기도,고양시,중식,짜장면,장가계,장가계,수타손짜장맛집
경기도,고양시,퓨전,홍꼬탕,비어힐,탄현 동네맛집 비어힐,"탄현주민들에게 정말 인기 많고, 자주 찾는 숨은 맛집"
경기도,고양시,한식,"돼지국밥, 밀면",가야밀면돼지국밥,가야밀면돼지국밥,부산에 돼지국밥과 밀면집보다 맛있는 집
경기도,고양시,한식,아구찜,경남식당,경남식당,고양시 아구찜 맛집
경기도,고양시,한식,물냉면,고자리 냉면,원당 냉면,"오이가 많이 들어간 냉면 맛집, 양많이! 외치면 곱빼기는 공짜"
경기도,고양시,한식,청국장,구산정,일산 맛집,일산 인근 청국장 넘버원 식당으로 소문난곳
경기도,고양시,한식,굴국밥,굴토리,굴토리,해장에는 이보다 없다!!
경기도,고양시,한식,갈비,나들목,덕이동 나들목,"돼지갈비의 부드럽고 깊은 맛!, 밑반찬도 일품!"
경기도,고양시,한식,양념꼬막,단이네 벌교꼬막,일산 벌교꼬막,"꼬막의 신세계를 맛볼 수 있고, 볶음밥을 추가요."
경기도,고양시,한식,칼국수,대가 칼국수,탄현동 대가칼국수,여름에 시원한 냉초계칼국수로 동네에서 인기 많은 맛집
경기도,고양시,한식,순두부/콩국수/보쌈,두리원,일산두리원,깔끔담백 맛있어요/ 100% 국산콩과 이미 수요미식회로 유명한집 강추
경기도,고양시,한식,돼지갈비,마이갈비,탄현 마이갈비,넉넉한 양과 수제 갈비가 맛있는 집
경기도,고양시,한식,삼겹살,맛찬들,라페스타 맛찬들,"와사비와 삼겹살의 조화, 매일 웨이팅이 있는 맛집"
경기도,고양시,한식,소갈비살,먹쇠,일산 먹쇠,저렴한 가격으로 소고기를 푸짐하게 맛볼 수 있는 맛집
경기도,고양시,한식,족발,백년족발,백년족발,"족발과 치킨, 짬뽕까지 주는 가성비좋은 족발집"
경기도,고양시,한식,게국지/간장게장,별미진미,별미진미,맛집방송 소개 및 소문난 지역 맛집
경기도,고양시,한식,"해물파전,고기전",숫돌골,삼송역 육전,해물이 엄청많이 들어간 두툼한 해물파전
경기도,고양시,한식,,신호등 장작구이,,장국구이
경기도,고양시,한식,냉면,아리랑면옥,아리랑면옥,덕이동 대표 냉면짐으로 갈비찜도 맛있음
경기도,고양시,한식,코다리냉면,오실장 강남면옥,일산냉면 오실장,"코다리냉면, 매운 갈비찜이 입에서 살살 녹는 맛집"
경기도,고양시,한식,닭 칼국수,일산교자,원당일산교자,원래 상호 일산칼국수에서 변경된 맛집 
경기도,고양시,한식,족발,장충동 한양할머니 족발,장충동 한양할머니 족발,"돼지특유의 냄새가 없고, 대형룸이 있어 단체회식에 적합"
경기도,고양시,한식,삼겹살,제주도야지삼송점,제주도야지삼송점,흑돼지 삼겹살 맛집
경기도,고양시,한식,"삼겹살, 조개찜",제주오라방,신원동 제주오라방,삼겹살과 조개찜을 같이 먹을수 있는 맛집
경기도,고양시,한식,칼국수/칼제비,종가집칼국수,일산 종가집칼국수,20년 현지인 보증 최고의 맛을 느낄 수 있는 진한 멸치 칼국수
경기도,고양시,한식,털레기,주막,덕이동 주막,연예인이 운영하는곳으로 보리밥과 수제비(털레기)가 대표메뉴임
경기도,고양시,한식,,지라산 어탕국수,,어탕국수
경기도,고양시,한식,해장국,철원 양평해장국,장항동 해장국,"일산에서 최고의 해장국, 장항 업체들이 식사로 제일 많이 가는 맛집"
경기도,고양시,한식,"양평해장국,곱창전골",철원양평해장국,원당 양평해장국,해장국도 맛있지만 매콤한 곱창전골이 일품
경기도,고양시,한식,,최현숙 족발보쌈,,족발/보쌈
경기도,고양시,한식,추어탕,추어정,추어정,영양식으로 남녀노소/ 추어탕 추어튀김등 맛이좋아 단골손님이 많음
경기도,고양시,한식,순대국,태기산순대국,태기산순대국,먹어본 순대국중에 가장 맛있는 랭킹 1위 맛집
경기도,고양시,한식,냉면,팔당냉면,대화동 팔당쌈냉면,더운여른 시원한 냉면과 직화구이의 환상적인 조합
경기도,고양시,한식,해물찜,허육도,허육도,싱싱한 해물로 요리하여 언제나 사람이 많은 허육도 추천
경기도,고양시,한식,갈비살,화로구이,화로구이,야채쌈을 무한으로 먹을수 있는 덕이동 대표 갈비집
경기도,고양시,한식,갈비,화전 분재원,화전분재원,돼지갈비의 부드럽고 깊은 맛
경기도,고양시,한식,부대찌게,훼미리부대찌게,훼미리부대찌게,"모던한디자인,깊은맛,청결,가성비 굿!"
경기도,광명시,한식,뼈다귀해장국,참이맛 뼈다귀,소하동 참이맛 뼈다귀,24시간 영업 고기가 부드럽고 맛있음 
경기도,광명시 ,한식,두루치기,돼지집,소하동 돼지집,
경기도,광명시 ,한식,고기,아침목장,가학동 아침목장,
경기도,광명시 ,한식,돼지갈비,충현갈비,소하동 충현갈비,전국 10대 갈비 2호점 저념한 가격의 냉면 서비스 돼지갈비 강츄
경기도,광주,한식,보리밥정식,들밥,광주들밥,"건강한 보리밥상과 산채정식,제육볶음과 생선구이가 일품,주변풍경과 시원한 정원에서 힐링"
경기도,광주,한식,소고기,먹보한우 광주점,먹보한우 광주점,광주에 갈때가 많이 없지만 맛있고 항상 사람들이 많음
경기도,광주시,"생생한 생등심, 왕갈비탕","생생한 생등심, 왕갈비탕",먹보한우 광주점,먹보한우 광주점,저온숙성 방식으로 지역주민 선호도 높음
경기도,광주시,양꼬치,"양꼬치, 양갈비",램브로 광주본점,램브로 광주본점,저렴한 가격과 지역 대표적인 맛집
경기도,광주시,"칼국수, 손만두국","칼국수, 손만두국",유주희 손만두국,유주희 손만두국,시원한 육수와 수타면으로 지역주민 선호도 높음
경기도,구리,분식,국물떡볶이,벅시분식,구리 벅시분식,생활의 달인에도 출연한 숨겨진 맛집! 떡볶이의 맛에 놀라고 가격에 놀랍니다.
경기도,구리,한식,부대찌개,미성식당,구리 미성식당,식사시간때 늘 줄서서 먹는 부대찌개 식당!! 양많은 사리와 끝내주는 국물!! 진정한 밥도둑입니다
경기도,구리,한식,오겹살,정진식당,구리 정진식당,엄청난 두께의 제주오겹살! 직원들이 직접 구워주고 정진식당 특제 젓갈에 찍어먹으면 아주그냥..
경기도,구리,한식,소곱창,토평 돌소곱창,토평 돌소곱창,"다 구워져서 나오는 소곱창, 부추와 함께 싸먹으면 없던 입맛도 생깁니다. 볶음밥도 예술"
경기도,구리시,한식,동태탕,시골식당,구리 동태탕 시골식당,"저렴한 가격,푸짐한 양,깔끔한 반찬"
경기도,군포시,베이커리,어니언킹/밀크프랑스,홍종흔 베이커리,홍종흔 베이커리,"한옥건축물을 개조한 고즈넉한 분위기에 쉼터도 많고, 명장이 직접 만든 특별한 빵들을 맛볼수 있음"
경기도,군포시,"설렁탕,수육,보쌈제육",설렁탕,군포식당,군포설렁탕맛집 군포식당,군포식당은 50년동안 설렁탕을 판매하는 집으로 백파 홍성유선생이 인정한 맛집이며 미식가들이 즐겨 찾는곳
경기도,김포,한식,홍어,남도식당,남도식당or 호프랑소주랑,"신선한 재료와 푸짐한 상차림,홍어코와 홍어애가 서비스~"
경기도,김포,한식,갈비탕,설반,설반,"신갈탕이라는 매운 갈비탕이 주메뉴,큼직한 갈비대 그대로 양도푸짐"
경기도,김포,한식,장어,양촌리 민물장어,김포 양촌리 민물장어,장어의 사이즈가 아나콘다~장어탕도 일품
경기도,김해시,한식,"육회비빔밥, 전골",하동한우국밥,하동한우국밥,깔끔하고 푸짐한 양과 함께 신선한 재료를 바탕으로 식사 및 안주용으로 최고!!!
경기도,남양주,한식,곱창전골,도농 병천 토종순대,도농병천토종순대,곱창전골이 정말 예술입니다. 끝내주는 국물과 엄청난 양의 고기들 최고입니다.
경기도,남양주시,콩탕,황태두부전골,고모네 콩탕,코모네 콩탕,"가격대비 가성비가 매우 높고 맛, 질에서 최고 맛집"
경기도,남양주시,한식,두부전골,천마산 손두부,천마산 손두부,주변 경치와 공기가 남다르고 직접 만드는 손두부로 맛두 일품~!
경기도,덕소,한식,숯불고기,덕소숯불고기,덕소숯불고기,석쇠로 구워 불향 가득 
경기도,별내,양식,스테이크,스테이크나인,스테이크나인,합리적인 가격에 분위기가 좋음
경기도,별내,한식,석쇠불고기,목향원,별내 목향원,풍경이 좋으며 삼색밥 또한 이색적임
경기도,별내동,한식,"해물칼국수, 낙지볶음",한송 칼국수,별내 한송칼국수,한옥 건물이 멋스러우며 칼국수 맛 또한 깔끔하며 별내에서는 유명한 맛집입니다.
경기도,부천시,보양식,삼계탕,고봉삼계탕,고봉삼계탕,"상황,한방 삼계탕등 국물이 진하고 깊이있음"
경기도,부천시,한식,짜글이,미쓰발랑코,중동 미쓰발랑코,"3대째 운영하고 있는 짜글이 가게로, 짜글이에 사용할 고기를 선택할 수 있으며, 짜글이 익히는 시간,
 즉 골든타임 12분이 생명인 맛집"
경기도,부천시,한식,해물찜,바닷가 왕해물찜,부천 해물찜,부천 해물맛집 
경기도,부천시,한식,삼겹살,엉터리 생고기 무한리필,중동 엉터리생고기 무한리필,1인 1만원 정도의 저렴한 가격에 무한리필되는 가성비 최고의 삼겹살과 샐러드바 제공
경기도,부천시,한식,제육볶음,제주도야지 김치전골(다랑치마을),중동 다랑치마을,"메뉴는 단순하지만, 제육볶음이 맛있어서 단골층이 많고, 밑반찬도 맛있어서
 밥 한끼하기에 좋음"
경기도,부천시,한식,보쌈,중동 다온황제해물문어보쌈,중동 다온황제해물문어보쌈,"해물과 보쌈 그리고 문어를 다함께 맛볼 수 있으며, 가족들과 즐기기에 적합함"
경기도,부천시,한식,장어,풍천민물장어 천장어 ,천장어 작동점,"직판장으로 가격이 다른 장어가게보다 2/3정도 수준으로 저렴하고, 대기열이 조금만 늦으면 오래 기다려야
 먹을 수 있을 정도로 많은 사람들이 찾는 곳"
경기도,산본,한식,쪽파곱창,먹방촌,산본 먹방촌,곱창에 쪽파가 들어간 맛집
경기도,산본,한식,동해골뱅이,왕통골뱅이,산본골뱅이,국물이 끝내주는 집
경기도,산본,한식,칼국수/수제비,홍두깨 칼국수,산본홍두깨칼국수,가성비 최고 칼국수/수제비 맛집
경기도,성남,한식,칼국수,대머리 칼국수,대머리 칼국수,바지락 칼국수와 닭한마리 칼국수가 정말 맛있는 맛집으로 성남에서 대머리 칼국수 모르면 간첩입니다!
경기도,성남,한식,빈대떡,동래파전,성남동래파전,"20년동안 자리잡은 맛집,빈대떡이 일품"
경기도,성남,한식,닭볶음탕,아지트,성남아지트,매운맛을 좋아하는 분들에게 강추!!꽃게가 들어간 닭볶음탕
경기도,성남,한식,해물찜,오늘손칼국수앤찜,성남오늘손칼국수,방송에도 나온 맛집. 신흥동에서 안가본사람이 없다는 식당
경기도,성남,한식,유황오리,풍경돌판구이,성남 풍경돌판구이,몸에좋은 오리고기를 야외에서 즐기고 마지막에 누른밥치즈말이가 압권
경기도,성남시,오리구이,"오리돌판구이 , 치즈야채누룽지",풍경오리돌판구미,태평동 풍경오리돌판구이,남녀노소 누구나 즐길수 있고 치즈야채누룽지를 만드는 과정이 재미있음
경기도,성남시,한식당,두부전문점,두향,두향,분당의 맛집에 선정되었으며 손두부의 유통기한은 24시간이며 엄선된 국내산 100%를 사용함
경기도,수원,한식,코다리,개성명가(집),광교 개성집,매콤하고 단백한맛
경기도,수원,한식,해천탕,문어스토리해천 본점,광교 해천,추운날 시원한 국물및 보양식으로 좋음
경기도,수원시,한식,추어탕,송담추어탕,송담추어탕 송담본점,뼈도 씹히지 않고 구수하고 담백한 맛
경기도,수원시 영통구,한식,추어탕,정담명가 남원추어탕,정담명가 남원추어탕,원천동 맛집 맛도 좋고 건강에도 좋은 영양만점의 추어탕집 추천
경기도,수원시 이의동,"두루치기, 김치찌개","두루치기, 김치찌개",돈가네 옛날김치찌개,광교 돈가네,가격대비 맛이 좋아 인근 직장인들이 많이 찾는 집
경기도,시흥시,육류,"족발,보쌈",장충당,장충당 시화정왕점,당일 직접 삶아 당일 판매해서 더욱더 맛있는 장충당 족발
경기도,시흥시,육류,갈비,전설갈비 두산점,전설갈비 두산점,"신기하게도 아파트 단지내에 있으며, 기본 밑반찬(양파장아찌, 나물, 샐러드 등)하고 김치 외에도 들깨미역국이 나오고
고소하고 따끈하고 갈비도 왕갈비, 매운갈비, 생과일갈비가 있는곳"
경기도,시흥시,중식,짬뽕,고구려 짬뽕,시흥 고구려 짬뽕,합리적인 가격과 맛에 블로그 맛집으로 유명함
경기도,시흥시,한식,칼국수,맛자랑,오이도 맛자랑,"오이도 앞 바다가 내려다보이는 탁트인 전망에 낙지, 키조개, 대합 등을 넣은 시원한 국물의 해물칼국수, 두툼하고 푸짐한 해물파전이 인기메뉴 / 대통령이 다녀 가신집으로 유명한 맛집입니다."
경기도,시흥시,한식,중식당,명가 노가나네 교동짬뽕,명가 노가나네 교동짬뽕,"먹으면 먹을수록 맛있고 뒤돌아서면 또다시 생각나는 맛집. 밥도 무한리필이라 따로 주문하지
 않아도 원하는데로 먹을수 있는곳"
경기도,시흥시,한식,부대찌개,모박사부대찌개,모박사부대찌개,파와 양파가 많이들어가 시원하고 깔끔한 맛이나는 곳
경기도,시흥시,한식,샤브샤브,소래버섯나라,소래버섯나라 본점,"샤브샤브 고유의 맛을 발전시켜 잊혀져가는 우리음식을 알리고, 자연 그대로의 맛을 즐기기 위해
 최상의 신성한 재료로 맛을 내는곳"
경기도,시흥시,한식,생선구이,자반고등어,정왕동 자반고등어,"생선구이, 조림이 메인인 자반고등어 메뉴는 단촐하나 4개의 기본찬은 그날그날 바뀌고 어떤 생선구이를 주문을 해도 김치찌개가 
기본으로 제공"
경기도,시흥시,한식,매운탕,토담골,물왕 토담골,"연근, 콩, 조, 흑미 등을 넣은 영양가마솥밥과 민물매운탕이 유명한 한식당(TV 다시방영) 푸른 나무와 분수가 있는 물레방아가 있어 
운치가 느껴지는 곳이며, 여러 가지 채소와 연근을 함께 넣은 메기찜과 빠가사리 매운탕이 대표 메뉴"
경기도,시흥시,한식,감자탕,홍가네감자탕,홍가네감자탕,무청시레기가 들어가 국물이 시원하고 양도 푸짐한곳
경기도,안산,한식,초계국수,망향식당,안산 망향식당,초계국수 와 비빔국수가 맛있는집
